{
  "version": "query_candidate_planner_shadow_accuracy_observation_dataset_v1",
  "datasetId": "beebeeai_query_candidate_shadow_accuracy_core_v1",
  "createdAt": "2026-08-05T13:20:00+08:00",
  "capturePolicyVersion": "query_candidate_planner_shadow_accuracy_capture_policy_v1",
  "sourceAccuracyDatasetVersion": "query_candidate_planner_accuracy_evaluation_dataset_v1",
  "sourceAccuracyDatasetId": "beebeeai_query_candidate_accuracy_core_v1",
  "dataPolicy": {
    "evaluationOnly": true,
    "rawRowsStored": false,
    "rawFileNamesStored": false,
    "userIdentityStored": false,
    "rawPrimaryResponseStored": false,
    "rawShadowResolutionStored": false,
    "candidateIdsLimitedToEvaluationLabels": true
  },
  "observations": [
    {
      "version": "query_candidate_planner_shadow_accuracy_observation_v1",
      "capturePolicyVersion": "query_candidate_planner_shadow_accuracy_capture_policy_v1",
      "observationId": "350bff6d44e2b01eb2047156b88dea9e0c92db94c317443dabd5010d27d8364c",
      "caseId": "hardcase_two_tables_one_sheet_waste",
      "requestFingerprintSha256": "3f83453c300ca0dafe97c07fe29bab1a8336873509d868add0c9e4e9eec5245f",
      "status": "COMPLETED",
      "reason": "SHADOW_COMPLETED",
      "primaryResponseUnchanged": true,
      "latencyMs": 1180,
      "comparison": {
        "verdict": "MATCH",
        "counts": {
          "primary": 3,
          "shadow": 3,
          "shared": 3,
          "primaryOnly": 0,
          "shadowOnly": 0
        },
        "metrics": {
          "exactOrder": true,
          "top1Same": true,
          "top3Overlap": 3,
          "jaccard": 1,
          "rankAgreement": 1
        },
        "rawIdentifiersIncluded": false
      },
      "shadowPrediction": {
        "candidates": [
          {
            "candidateId": "budget_execution_summary",
            "rank": 1,
            "status": "ACCEPTED",
            "productionEligible": true
          },
          {
            "candidateId": "budget_variance_analysis",
            "rank": 2,
            "status": "ACCEPTED",
            "productionEligible": true
          },
          {
            "candidateId": "budget_category_breakdown",
            "rank": 3,
            "status": "ACCEPTED",
            "productionEligible": true
          }
        ],
        "domain": "FINANCE_BUDGET",
        "intent": "BUDGET_EXECUTION",
        "fallbackApplied": false,
        "fallbackReason": "",
        "unsupportedRejected": false,
        "reviewRequired": false
      },
      "guardrails": {
        "shadowOnly": true,
        "primaryResponseAuthority": true,
        "responsePayloadMutation": false,
        "responseHeaderMutation": false,
        "responseStatusMutation": false,
        "productionCandidateMerge": false,
        "productionReadyAssignment": false,
        "productionRouteChanged": false
      },
      "privacy": {
        "rawPrimaryResponseIncluded": false,
        "rawShadowResolutionIncluded": false,
        "rawRowsIncluded": false,
        "sampleValuesIncluded": false,
        "fileNameIncluded": false,
        "originalFileNameIncluded": false,
        "queryTablesKeyIncluded": false,
        "userIdentityIncluded": false,
        "tenantIdIncluded": false
      }
    },
    {
      "version": "query_candidate_planner_shadow_accuracy_observation_v1",
      "capturePolicyVersion": "query_candidate_planner_shadow_accuracy_capture_policy_v1",
      "observationId": "b16c095746f7cee1db693a828a98af3ba2849f5a9a707e98ab90eae019d30e08",
      "caseId": "real_world_event_applicant_workshop",
      "requestFingerprintSha256": "49cda717f4ceb6382529c3cb3490568de5daae0b14d0ccdf1a9897fd83433f1a",
      "status": "COMPLETED",
      "reason": "SHADOW_COMPLETED",
      "primaryResponseUnchanged": true,
      "latencyMs": 980,
      "comparison": {
        "verdict": "MATCH",
        "counts": {
          "primary": 3,
          "shadow": 3,
          "shared": 3,
          "primaryOnly": 0,
          "shadowOnly": 0
        },
        "metrics": {
          "exactOrder": true,
          "top1Same": true,
          "top3Overlap": 3,
          "jaccard": 1,
          "rankAgreement": 1
        },
        "rawIdentifiersIncluded": false
      },
      "shadowPrediction": {
        "candidates": [
          {
            "candidateId": "event_attendance_summary",
            "rank": 1,
            "status": "ACCEPTED",
            "productionEligible": true
          },
          {
            "candidateId": "applicant_status_breakdown",
            "rank": 2,
            "status": "ACCEPTED",
            "productionEligible": true
          },
          {
            "candidateId": "participant_roster",
            "rank": 3,
            "status": "ACCEPTED",
            "productionEligible": true
          }
        ],
        "domain": "EVENT_ATTENDANCE",
        "intent": "APPLICATION_TRACKING",
        "fallbackApplied": false,
        "fallbackReason": "",
        "unsupportedRejected": false,
        "reviewRequired": false
      },
      "guardrails": {
        "shadowOnly": true,
        "primaryResponseAuthority": true,
        "responsePayloadMutation": false,
        "responseHeaderMutation": false,
        "responseStatusMutation": false,
        "productionCandidateMerge": false,
        "productionReadyAssignment": false,
        "productionRouteChanged": false
      },
      "privacy": {
        "rawPrimaryResponseIncluded": false,
        "rawShadowResolutionIncluded": false,
        "rawRowsIncluded": false,
        "sampleValuesIncluded": false,
        "fileNameIncluded": false,
        "originalFileNameIncluded": false,
        "queryTablesKeyIncluded": false,
        "userIdentityIncluded": false,
        "tenantIdIncluded": false
      }
    },
    {
      "version": "query_candidate_planner_shadow_accuracy_observation_v1",
      "capturePolicyVersion": "query_candidate_planner_shadow_accuracy_capture_policy_v1",
      "observationId": "e5c402b9855d711ab0d8069acab8610bd24dd82d4e58d8d67bfea47ccf9a2e5a",
      "caseId": "seed_attendance_conditional",
      "requestFingerprintSha256": "916708b2e8912950eeb11086703c47be7a0c87aed6f280c47d35089e2f66c2f8",
      "status": "COMPLETED",
      "reason": "SHADOW_COMPLETED",
      "primaryResponseUnchanged": true,
      "latencyMs": 720,
      "comparison": {
        "verdict": "MATCH",
        "counts": {
          "primary": 2,
          "shadow": 2,
          "shared": 2,
          "primaryOnly": 0,
          "shadowOnly": 0
        },
        "metrics": {
          "exactOrder": true,
          "top1Same": true,
          "top3Overlap": 2,
          "jaccard": 1,
          "rankAgreement": 1
        },
        "rawIdentifiersIncluded": false
      },
      "shadowPrediction": {
        "candidates": [
          {
            "candidateId": "attendance_status_summary",
            "rank": 1,
            "status": "ACCEPTED",
            "productionEligible": true
          },
          {
            "candidateId": "attendance_rate_analysis",
            "rank": 2,
            "status": "ACCEPTED",
            "productionEligible": true
          }
        ],
        "domain": "EVENT_ATTENDANCE",
        "intent": "ATTENDANCE_TRACKING",
        "fallbackApplied": false,
        "fallbackReason": "",
        "unsupportedRejected": false,
        "reviewRequired": false
      },
      "guardrails": {
        "shadowOnly": true,
        "primaryResponseAuthority": true,
        "responsePayloadMutation": false,
        "responseHeaderMutation": false,
        "responseStatusMutation": false,
        "productionCandidateMerge": false,
        "productionReadyAssignment": false,
        "productionRouteChanged": false
      },
      "privacy": {
        "rawPrimaryResponseIncluded": false,
        "rawShadowResolutionIncluded": false,
        "rawRowsIncluded": false,
        "sampleValuesIncluded": false,
        "fileNameIncluded": false,
        "originalFileNameIncluded": false,
        "queryTablesKeyIncluded": false,
        "userIdentityIncluded": false,
        "tenantIdIncluded": false
      }
    },
    {
      "version": "query_candidate_planner_shadow_accuracy_observation_v1",
      "capturePolicyVersion": "query_candidate_planner_shadow_accuracy_capture_policy_v1",
      "observationId": "8efd97c216411d213847790e066dc42c1763872a7263e75f119cb8fa1caec4f7",
      "caseId": "seed_sales_ready",
      "requestFingerprintSha256": "14e6a16c69395e2f763fcd0e722ee5cc3df9616c8a11c4486b8318f0e12f40df",
      "status": "COMPLETED",
      "reason": "SHADOW_COMPLETED",
      "primaryResponseUnchanged": true,
      "latencyMs": 1050,
      "comparison": {
        "verdict": "MATCH",
        "counts": {
          "primary": 3,
          "shadow": 3,
          "shared": 3,
          "primaryOnly": 0,
          "shadowOnly": 0
        },
        "metrics": {
          "exactOrder": true,
          "top1Same": true,
          "top3Overlap": 3,
          "jaccard": 1,
          "rankAgreement": 1
        },
        "rawIdentifiersIncluded": false
      },
      "shadowPrediction": {
        "candidates": [
          {
            "candidateId": "sales_summary",
            "rank": 1,
            "status": "ACCEPTED",
            "productionEligible": true
          },
          {
            "candidateId": "revenue_by_category",
            "rank": 2,
            "status": "ACCEPTED",
            "productionEligible": true
          },
          {
            "candidateId": "sales_trend",
            "rank": 3,
            "status": "ACCEPTED",
            "productionEligible": true
          }
        ],
        "domain": "SALES_REVENUE",
        "intent": "TRANSACTION_ANALYSIS",
        "fallbackApplied": false,
        "fallbackReason": "",
        "unsupportedRejected": false,
        "reviewRequired": false
      },
      "guardrails": {
        "shadowOnly": true,
        "primaryResponseAuthority": true,